category,question,option1,option2,option3,option4,correct_answer,explanation
ステップ３産業,自動運転の先進地域として挙げられている自治体は？,愛知県豊田市,福井県永平寺町,茨城県つくば市,沖縄県北谷町,2,福井県永平寺町ではレベル4の自動運転バスが導入されています。
ステップ３産業,国際標準化会合での日本人議長数について言及されている状況は？,主要国より多い,主要国と同程度,主要国に比べて少ない,データが不明,3,ISO／IECなど国際標準化会合での日本人議長数は主要国に比べて少ないとされています。
ステップ３産業,実証特区の主要な目的は？,技術開発の促進,規制の緩和,事業化の支援,すべて含む,4,技術開発、規制緩和、事業化支援すべてが目的です。
ステップ３産業,官民ファンドの役割として重視されているのは？,リスクマネーの供給,技術開発支援,市場開拓支援,すべて含む,4,リスクマネー供給、技術開発、市場開拓すべてが役割です。
ステップ３産業,インテリジェンス・プラットフォームの目的は？,情報収集,分析・共有,戦略立案,すべて含む,4,情報収集、分析・共有、戦略立案すべてが目的です。
ステップ３産業,カーボンフットプリントについて重視されている取り組みは？,測定の標準化,削減目標の設定,国際連携の強化,すべて含む,4,測定標準化、削減目標、国際連携すべてが重要です。
ステップ３産業,自動運転レベル4の特徴は？,限定地域での完全自動運転,高速道路での自動運転,一般道での部分自動運転,すべての道路での完全自動運転,1,限定された地域での完全自動運転がレベル4の特徴です。
ステップ３産業,国際標準化での日本の課題は？,技術力不足,参加度不足,影響力不足,すべて含む,3,国際標準化会合での影響力不足が主要な課題です。