category,question,option1,option2,option3,option4,correct_answer,explanation
ステップ２医療,このマニフェストが掲げる医療制度のビジョンとして、最も適切なものはどれですか？,国民皆保険制度を廃止し、自由診療を中心とした制度へ移行する。,医療費を大幅に削減するため、医療へのアクセスを制限する。,テクノロジーとデータを活用し、非効率を減らし費用対効果の高い医療が報われる制度を目指す。,高齢者の医療費自己負担を一律に引き上げることで、現役世代の負担を軽減する。,3,マニフェストでは、テクノロジーとデータを活用して医療の非効率を減らし、費用対効果の高い医療が報われる制度を目指すとしています。
ステップ２医療,現状の医療保険制度における自己負担割合の決定要因として、文書で指摘されている主なものは何ですか？,受ける医療の内容と重症度,年齢と所得,居住地域と家族構成,加入している保険組合の種類,2,文書では「主に年齢と所得により個々の自己負担割合が決定され、受ける医療の内容や重症度に応じた調整は行われていません」と指摘されています。
ステップ２医療,OECDの報告によると、国際的に医療費のおよそ何割が健康成果に直結していない可能性があるとされていますか？,約1割,約2割,約3割,約5割,2,文書には「OECDの報告では国際的に医療費のおよそ２割が健康成果に直結していない可能性を示しており」と記載されています。
ステップ２医療,政策として提案されている、診療行為のエビデンスや費用対効果に基づく自己負担割合の調整は、どのような目的で行われますか？,医療機関の収益を最大化するため。,患者の医療選択の自由を制限するため。,医療の質と家計への負担を維持しつつ、医療財政への負担を軽減するため。,最新医療技術の導入を抑制するため。,3,文書では「これらの仕組みにより、医療の質、家計への負担を維持したまま、医療財政への負担軽減を目指します」と述べられています。
ステップ２医療,フランスで導入されている医薬品の自己負担割合設定の仕組みについて、正しい記述はどれですか？,全ての医薬品で自己負担割合が一律に設定されている。,医薬品の有効性評価に基づき、自己負担割合が段階的に設定され、抗がん剤など代替の効かない薬は0%になる場合がある。,評価が不十分な医薬品は、国が全額負担する。,医薬品の価格のみに基づいて自己負担割合が決定される。,2,フランスの事例として、医薬品の有効性評価に基づき自己負担割合が段階的に設定され、抗がん剤など代替の効かない医薬品は自己負担0%となることが紹介されています。
ステップ２医療,日本の医療費の約3割を占めるとされる慢性疾患として、文書で例示されていないものはどれですか？,糖尿病,COPD（慢性閉塞性肺疾患）,心不全,関節リウマチ,4,文書では、糖尿病・COPD・心不全などが慢性疾患の例として挙げられています。関節リウマチは明記されていません。
ステップ２医療,提案されている「治療成果に報いる医療アウトカム評価制度」の主な目的は何ですか？,診療回数を増やすことで医療機関の収益を向上させること。,「どれだけ診療が行われたか」だけでなく、「どれだけ良くなったか」にも報いる医療制度へ転換すること。,患者の自己負担額を大幅に引き上げること。,医師の診断の自由度を制限すること。,2,この制度は、「どれだけ診療が行われたか」だけでなく、「どれだけ良くなったか」にも報いる医療制度への転換を目指しています。
ステップ２医療,医療アウトカム評価制度の導入にあたり、診療データの管理・活用について、どのような方針が示されていますか？,各医療機関が個別にデータを管理し、必要に応じて共有する。,診療データを匿名化し、全国医療データベース（NDB）で一元管理し、AIを活用して評価する。,患者自身が全ての診療データを管理し、医療機関に提供する。,紙ベースのカルテを維持し、手作業で評価を行う。,2,診療データを匿名化し、NDBで一元管理し、AIを活用した公平で迅速な評価を行う仕組みを整える方針が示されています。
