category,question,option1,option2,option3,option4,correct_answer,explanation
ステップ１産業,チームみらいが提案するAIリスキリング支援の年間目標人数は？,50万人,100万人,150万人,200万人,2,年間100万人規模の支援を目指すとされています。
ステップ１産業,チームみらいが重視するAIシフト推進の主要な課題は？,技術の未成熟,予算の不足,人材の不足,規制の複雑さ,3,AI/データ人材の不足が主要な課題として挙げられています。
ステップ１産業,チームみらいが提案する中小企業AI導入支援で重視される要素は？,技術の先進性,導入コストの低減,実用性と効果の実証,国際競争力の向上,3,実用性と効果の実証が重視されています。
ステップ１産業,チームみらいが考えるDX推進における政府の役割は？,規制の強化,技術開発の主導,環境整備と支援,市場への直接参入,3,政府は環境整備と支援の役割を担うとされています。
ステップ１産業,チームみらいが目指すAIシフトの基本方針は？,大企業優先,技術者養成重視,誰も取り残さない包括的推進,効率性優先,3,「誰も取り残さない」理念に基づく包括的なAIシフト推進が基本方針です。
ステップ１産業,チームみらいが提案する産業政策の特徴は？,競争力強化,技術革新,人材育成,すべて含む,4,競争力強化、技術革新、人材育成すべてを包括した政策が特徴です。
ステップ１産業,AIリスキリング支援でチームみらいが重視する対象は？,IT専門職のみ,管理職のみ,全職種・全世代,若手のみ,3,すべての職種・世代を対象とした包括的な支援を重視しています。
ステップ１産業,チームみらいが考える日本のAI活用の現状認識は？,世界最先端,平均的水準,大幅に遅れている,導入がわずか,4,生成AIを実際に業務へ取り込んでいる企業はわずかという現状認識です。