category,question,option1,option2,option3,option4,correct_answer,explanation
ステップ１産業,このマニフェストが掲げる産業のビジョンにおいて、特に今後の日本経済の成長のカギを握ると位置づけられているものは何ですか？,ロボット技術,AI（人工知能）,バイオテクノロジー,宇宙開発,2,マニフェストでは「特にAIについては、今後の日本経済の成長のカギを握るものと位置づけ」と明記されています。
ステップ１産業,マニフェストが目指す産業支援の方策において、効率化、高度化、利便性の向上を図るために活用するものは何ですか？,伝統的な職人技,海外からの直接投資,AI・IT,大規模な公共事業,3,「支援の方策については、AI・ITも活用し効率化と高度化、利便性の向上を図ることで、広く深い支援を実現し、確実な成果に結び付けていきます」と記載されています。
ステップ１産業,2024年の帝国データバンクの調査によると、生成AIを業務へ取り込んでいる企業の現状として正しいものはどれですか？,多くの企業が導入し、大きな成果を上げている,導入企業はわずかで、効果を実感できない企業が多い,中小企業を中心に導入が進み、大企業が遅れている,導入した企業は多いが、コストが高すぎるとの声が多い,2,「生成 AI を実際に業務へ取り込んでいる企業はわずかであり、導入した企業の大半が「効果を実感できない」と答えるなど、熱気と成果の間には大きな隔たりがあるのが現状です」と述べられています。
ステップ１産業,多くのAIプロジェクトがPoC（概念実証）の段階で止まってしまう「PoCの墓場」に陥る背景にある、深刻な問題として指摘されているものは何ですか？,AI技術の信頼性の低さ,企業の資金不足,深刻な人材不足,政府の規制強化,3,「こうした停滞の背後には深刻な人材不足があり、経済産業省の推計では、2030 年にデータ／AI 人材が約 79 万人不足する見込みとなっています」と明記されています。
ステップ１産業,AIシフト実現のための政策として、年間100万人規模の支援を目指す「AIリスキリング支援」の主な対象として特に重視されているのはどのような企業ですか？,大企業やグローバル企業,スタートアップ企業やベンチャー企業,中小企業や地方の企業,外資系企業や海外進出企業,3,「特に中小企業や地方の企業の社員を中心的に支援することで、日本の産業全体の底上げを図ります」と記載されています。
ステップ１産業,日本の産業支援制度に関する現状の評価として、マニフェストで指摘されている課題は何ですか？,メニューは少ないが非常に使いやすい,メニューは多いが使いにくい,メニューは豊富で、どの企業も容易に利用できる,メニューは限定的だが、専門性が高い,2,「日本の産業支援制度は「メニューは多いが使いにくい」という評価が定着しています」と述べられています。
ステップ１産業,支援制度のデジタルワンストップ化において、AIが企業の財務データや事業計画を解析して行うことは何ですか？,新たな事業計画の自動作成,競合他社の情報分析,最適な支援制度の提案,従業員のスキル評価,3,「政府・自治体・JETRO の支援メニューを API で統合し、AI が企業の財務データや事業計画を解析して最適な制度を提案します」と記載されています。
ステップ１産業,海外展開支援のフルデジタル化において、J-Bridgeを拡張して提供される機能に含まれないものはどれですか？,AIマッチングによる商談先リスト作成,自動翻訳機能,国別規制チェック,現地でのオフィス契約代行,4,マニフェストには「J-Bridge を拡張し、AI マッチングによる商談先リスト作成、自動翻訳、国別規制チェックを一つの画面で完結させる」とあり、現地でのオフィス契約代行については言及されていません。
