category,question,option1,option2,option3,option4,correct_answer,explanation
ステップ１医療,このマニフェストが掲げる医療分野のビジョンとして、テクノロジーの力で主に何を支援すると述べていますか？,医療機関の経営および業務効率化,新薬の開発促進,医師の給与水準向上,海外からの患者誘致,1,マニフェストのビジョンでは「医療の現場をテクノロジーの力で支援することで、医療機関の経営および業務効率化を支援します」と明記されています。
ステップ１医療,マニフェストによると、オンライン診療の普及や医療機関での待機時間の短縮は、特にどのような人々の医療アクセス格差の是正につながるとされていますか？,ITリテラシーの高い働き世代や若い方々,外出が困難な要介護者の方や僻地などで医療アクセスが困難な方々,海外在住の日本人,スポーツ選手などの特殊な健康管理が必要な人々,2,マニフェストのビジョンには「オンライン診療の普及や医療機関での待機時間の短縮は外出が困難な要介護者の方や僻地などで医療アクセスが困難な方々に対しての医療アクセス格差の是正にもつながります」と記載されています。
ステップ１医療,オンライン診療の普及状況について、2023年のアンケート調査結果としてマニフェストではどのように述べられていますか？,回答者の半数以上がオンライン診療を利用したことがある,回答者の9割がオンライン診療を知っているが、利用経験者は1割弱に留まる,オンライン診療の認知度は低いが、利用者の満足度は非常に高い,若年層ではオンライン診療が対面診療よりも主流になっている,2,マニフェストでは「2023年に行われたアンケート調査でも回答者の9割がオンライン診療について知っていると回答しましたが、実際に自身・家族が利用したことがあると答えた人は1割弱に留まりました」と指摘しています。
ステップ１医療,オンライン診療が進まない要因の一つとして、マニフェストで指摘されていないものは次のうちどれですか？,現在の診療報酬制度ではオンライン診療が対面診療と比べて優遇されていないこと,オンライン診療で医師に相談後、薬の受け取りに調剤薬局を訪ねる必要があること,患者側のプライバシー意識が高すぎること,オンライン診療の質や安全対策の整備が十分でないこと,3,マニフェストではオンライン診療が進まない要因として診療報酬制度、薬の受け取り、質・安全対策などを挙げていますが、「患者側のプライバシー意識が高すぎること」は直接的な要因として指摘されていません。
ステップ１医療,オンライン診療普及のための政策として、マニフェストで提案されていないものは次のうちどれですか？,オンライン診療を普及するための診療報酬の加算を検討する,オンライン診療のユースケースを整備し、段階的に普及するための枠組みを整備する,オンライン診療の利用を全国民に義務付ける,セキュアに遠隔診療を提供するため医療機関のインフラ整備の支援を行う,3,マニフェストでは診療報酬加算、ユースケース整備、インフラ整備支援などを提案していますが、「オンライン診療の利用を全国民に義務付ける」といった強制的な提案はされていません。
